Category,Message
ham,"Go until jurong point, crazy.. Available only in bugis n great world la e buffet... Cine there got amore wat..."
spam,"Free entry in 2 a wkly comp to win FA Cup final tkts 21st May 2005. Text FA to 87121 to receive entry question(std txt rate)T&C's apply 08452810075over18's"
ham,"U dun say so early hor... U c already then say..."
spam,"FreeMsg Hey there darling it's been 3 week's now and no word back! I'd like some fun you up for it still? Chg $1.50 rcv, rcv msg"
ham,"Even my brother is not like to speak with me. They treat me like aids patent."
spam,"WINNER!! As a valued network customer you have been selected to receivea £900 prize reward! To claim call 09061701461. Claim code KL341. Valid 12 hours only."
ham,"As per your request 'Melle Melle (Oru Minnaminunginte Nurungu Vettam)' has been set as your callertune for all Callers. Press *9 to copy your friends Callertune"
spam,"URGENT! You have won a 1-week FREE membership in our £100,000 Prize Jackpot! Txt the word: CLAIM to No: 81010 T&C www.dbuk.net LCCLTD POBOX 4403LDNW1A7RW18"